PT	AU	BA	CA	GP	RI	OI	BE	Z2	TI	X1	Y1	Z1	FT	PN	AE	Z3	SO	S1	SE	BS	VL	IS	SI	MA	BP	EP	AR	DI	D2	SU	PD	PY	AB	X4	Y4	Z4	AK	CT	CY	SP	CL	TC	Z8	ZB	ZS	Z9	SN	BN	UT	PM
J	Ijichi, Chiori; Wakabayashi, Hidehiko; Sugiyama, Shingo; Ihara, Yusuke; Nogi, Yasuko; Nagashima, Ayumi; Ihara, Sayoko; Niimura, Yoshihito; Shimizu, Yuya; Kondo, Kenji; Touhara, Kazushige								Metabolism of Odorant Molecules in Human Nasal/Oral Cavity Affects the Odorant Perception								CHEMICAL SENSES				44	7			465	481		10.1093/chemse/bjz041			SEP 2019	2019										0							WOS:000493389500328		
J	Trimmer, C.; Keller, A.; Murphy, N. R.; Snyder, L. L.; Willer, J. R.; Nagai, M. H.; Katsanis, N.; Vosshall, L. B.; Matsunami, H.; Mainland, J. D.								Genetic variation across the human olfactory receptor repertoire alters odor perception								PROCEEDINGS OF THE NATIONAL ACADEMY OF SCIENCES OF THE UNITED STATES OF AMERICA				116	19			9475	9480		10.1073/pnas.1804106115			MAY 7 2019	2019										5							WOS:000467226400048		
J	Precone, V.; Beccari, T.; Stuppia, L.; Baglivo, M.; Paolacci, S.; Manara, E.; Miggiano, G. A. D.; Falsini, B.; Trifiro, A.; Zanlari, A.; Herbst, K. L.; Unfer, V.; Bertelli, M.		GENEOB Project						Taste, olfactory and texture related genes and food choices: implications on health status								EUROPEAN REVIEW FOR MEDICAL AND PHARMACOLOGICAL SCIENCES				23	3			1305	1321					FEB 2019	2019										1							WOS:000459178100049		
J	Dalton, Pamela; Maute, Christopher								Odours and incontinence: What does the nose know?								PROCEEDINGS OF THE INSTITUTION OF MECHANICAL ENGINEERS PART H-JOURNAL OF ENGINEERING IN MEDICINE				233	1			127	134		10.1177/0954411918781409			JAN 2019	2019										0							WOS:000456400400013		
J	Niimura, Yoshihito; Matsui, Atsushi; Touhara, Kazushige								Acceleration of Olfactory Receptor Gene Loss in Primate Evolution: Possible Link to Anatomical Change in Sensory Systems and Dietary Transition								MOLECULAR BIOLOGY AND EVOLUTION				35	6			1437	1450		10.1093/molbev/msy042			JUN 2018	2018										8							WOS:000441140000019		
J	Connor, Erin E.; Zhou, Yang; Liu, George E.								The essence of appetite: does olfactory receptor variation play a role?								JOURNAL OF ANIMAL SCIENCE				96	4			1551	1558		10.1093/jas/sky068			APR 2018	2018										1							WOS:000430344400032		
J	Hofmann, Thomas; Krautwurst, Dietmar; Schieberle, Peter								Current Status and Future Perspectives in Flavor Research: Highlights of the 11th Wartburg Symposium on Flavor Chemistry & Biology								JOURNAL OF AGRICULTURAL AND FOOD CHEMISTRY				66	10			2197	2203		10.1021/acs.jafc.7b06144			MAR 14 2018	2018										9							WOS:000427910500001		
J	Fjaeldstad, A.; Petersen, M. A.; Ovesen, T.								Considering Chemical Resemblance: a Possible Confounder in Olfactory Identification Tests								CHEMOSENSORY PERCEPTION				10	1-2			42	48		10.1007/s12078-017-9226-6			JUN 2017	2017										2							WOS:000404552700006		
J	Geithe, Christiane; Noe, Franziska; Kreissl, Johanna; Krautwurst, Dietmar								The Broadly Tuned Odorant Receptor OR1A1 is Highly Selective for 3-Methyl-2,4-nonanedione, a Key Food Odorant in Aged Wines, Tea, and Other Foods								CHEMICAL SENSES				42	3			181	193		10.1093/chemse/bjw117			MAR 2017	2017										15							WOS:000397066100002		
J	Noe, Franziska; Polster, Johannes; Geithe, Christiane; Kotthoff, Matthias; Schieberle, Peter; Krautwurst, Dietmar								OR2M3: A Highly Specific and Narrowly Tuned Human Odorant Receptor for the Sensitive Detection of Onion Key Food Odorant 3-Mercapto-2-methylpentan-1-ol								CHEMICAL SENSES				42	3			195	210		10.1093/chemse/bjw118			MAR 2017	2017										12							WOS:000397066100003		
J	Kawamura, Shoji; Melin, Amanda D.								Evolution of Genes for Color Vision and the Chemical Senses in Primates								Evolutionary Studies				1				181	216		10.1007/978-4-431-56603-8_10			2017	2017										5							WOS:000444996800011		
J	Galibert, Francis; Azzouzi, Naoual; Quignon, Pascale; Chaudieu, Gilles								The genetics of canine olfaction								JOURNAL OF VETERINARY BEHAVIOR-CLINICAL APPLICATIONS AND RESEARCH				16				86	93		10.1016/j.jveb.2016.06.012			NOV-DEC 2016	2016										1							WOS:000390635900012		
J	Marenco, Luis; Wang, Rixin; McDougal, Robert; Olender, Tsviya; Twik, Michal; Bruford, Elspeth; Liu, Xinyi; Zhang, Jian; Lancet, Doron; Shepherd, Gordon; Crasto, Chiquito								ORDB, HORDE, ODORactor and other on-line knowledge resources of olfactory receptor-odorant interactions								DATABASE-THE JOURNAL OF BIOLOGICAL DATABASES AND CURATION										baw132	10.1093/database/baw132			OCT 2 2016	2016										2							WOS:000386640100001		
J	Keller, Andreas; Vosshall, Leslie B.								Olfactory perception of chemically diverse molecules								BMC NEUROSCIENCE				17						55	10.1186/s12868-016-0287-2			AUG 8 2016	2016										32							WOS:000381829800001		
J	Molnar, Janos; Szakacs, Gergely; Tusnady, Gabor E.								Characterization of Disease-Associated Mutations in Human Transmembrane Proteins								PLOS ONE				11	3					e0151760	10.1371/journal.pone.0151760			MAR 17 2016	2016										11							WOS:000372580300125		
J	Silva Teixeira, Carla S.; Cerqueira, Nuno M. F. S. A.; Silva Ferreira, Antonio C.								Unravelling the Olfactory Sense: From the Gene to Odor Perception								CHEMICAL SENSES				41	2			105	121		10.1093/chemse/bjv075			FEB 2016	2016										21							WOS:000370132400002		
J	Running, Cordelia A.; Hayes, John E.								Individual Differences in Multisensory Flavor Perception								Woodhead Publishing Series in Food Science Technology and Nutrition				298				185	210		10.1016/B978-0-08-100350-3.00010-9			2016	2016										3							WOS:000402293000011		
J	Fjaeldstad, Alexander; van Hartevelt, Tim J.; Kringelbach, Morten L.								Pleasure of Food in the Brain								Woodhead Publishing Series in Food Science Technology and Nutrition				298				211	234		10.1016/B978-0-08-100350-3.00011-0			2016	2016										4							WOS:000402293000012		
J	Choong, Wai-Kok; Chang, Hui-Yin; Chen, Ching-Tai; Tsai, Chia-Feng; Hsu, Wen-Lian; Chen, Yu-Ju; Sung, Ting-Yi								Informatics View on the Challenges of Identifying Missing Proteins from Shotgun Proteomics								JOURNAL OF PROTEOME RESEARCH				14	12			5396	5407		10.1021/acs.jproteome.5b00482			DEC 2015	2015										10							WOS:000366151800043		
J	Geithe, Christiane; Andersen, Gaby; Malki, Agne; Krautwurst, Dietmar								A Butter Aroma Recombinate Activates Human Class-I Odorant Receptors								JOURNAL OF AGRICULTURAL AND FOOD CHEMISTRY				63	43			9410	9420		10.1021/acs.jafc.5b01884			NOV 4 2015	2015						1st ACS-AGFD and ACSThailand Chapter Joint Symposium	MAR 04-05, 2014		Bangkok, THAILAND	15							WOS:000364355700005		
J	Jiang, Yue; Matsunami, Hiroaki								Mammalian odorant receptors: functional evolution and variation								CURRENT OPINION IN NEUROBIOLOGY				34				54	60		10.1016/j.conb.2015.01.014			OCT 2015	2015										17							WOS:000362139300009		
J	Gilbert, Jessica L.; Guthart, Matthew J.; Gezan, Salvador A.; de Carvalho, Melissa Pisaroglo; Schwieterman, Michael L.; Colquhoun, Thomas A.; Bartoshuk, Linda M.; Sims, Charles A.; Clark, David G.; Olmstead, James W.								Identifying Breeding Priorities for Blueberry Flavor Using Biochemical, Sensory, and Genotype by Environment Analyses								PLOS ONE				10	9					e0138494	10.1371/journal.pone.0138494			SEP 17 2015	2015										15							WOS:000361769400106		
J	Hoover, Kara C.; Gokcumen, Omer; Qureshy, Zoya; Bruguera, Elise; Savangsuksa, Aulaphan; Cobb, Matthew; Matsunami, Hiroaki								Global Survey of Variation in a Human Olfactory Receptor Gene Reveals Signatures of Non-Neutral Evolution								CHEMICAL SENSES				40	7			481	488		10.1093/chemse/bjv030			SEP 2015	2015										6							WOS:000361528400005		
J	Malki, Agne; Fiedler, Julia; Fricke, Kristina; Ballweg, Ines; Pfaffl, Michael W.; Krautwurst, Dietmar								Class I odorant receptors, TAS1R and TAS2R taste receptors, are markers for subpopulations of circulating leukocytes								JOURNAL OF LEUKOCYTE BIOLOGY				97	3			533	545		10.1189/jlb.2A0714-331RR			MAR 2015	2015										56							WOS:000350250000012		
J	Geithe, Christiane; Krautwurst, Dietmar								Chirality Matters - Enantioselective Orthologous Odorant Receptors for Related Terpenoid Structures								ACS Symposium Series				1212				161	181					2015	2015						Symposium on the Importance of Chirality to Flavor Compounds / 248th American-Chemical-Society Meeting and Exposition	AUG 10-14, 2014	Amer Chem Soc, Div Agr & Food Chem; Frey&Lau GmbH; Givaudan; Symrise AG; T Hasegawa Co Ltd; Wild Flavors	San Francisco, CA	4							WOS:000370679400012		
J	Razafindrazaka, Harilanto; Monnereau, Aurore; Razafindrazaka, Dina; Tonasso, Laure; Schiavinato, Stephanie; Rakotoarisoa, Jean-Aime; Radimilahy, Chantal; Letellier, Thierry; Pierron, Denis								Genetic Admixture and Flavor Preferences: Androstenone Sensitivity in Malagasy Populations								HUMAN BIOLOGY				87	1			59	70		10.13110/humanbiology.87.1.0059			JAN 2015	2015										4							WOS:000361915900005		
J	Yoder, Anne D.; Larsen, Peter A.								The molecular evolutionary dynamics of the vomeronasal receptor (class 1) genes in primates: a gene family on the verge of a functional breakdown								FRONTIERS IN NEUROANATOMY				8						153	10.3389/fnana.2014.00153			DEC 12 2014	2014										8							WOS:000347442400001		
J	Boeker, Peter								On 'Electronic Nose' methodology								SENSORS AND ACTUATORS B-CHEMICAL				204				2	17		10.1016/j.snb.2014.07.087			DEC 1 2014	2014										75							WOS:000343116400001		
J	Hayden, Sara; Teeling, Emma C.								The Molecular Biology of Vertebrate Olfaction								ANATOMICAL RECORD-ADVANCES IN INTEGRATIVE ANATOMY AND EVOLUTIONARY BIOLOGY				297	11			2216	2226		10.1002/ar.23031			NOV 2014	2014										7							WOS:000343871800020		
J	Logan, Darren W.								Do you smell what I smell? Genetic variation in olfactory perception								BIOCHEMICAL SOCIETY TRANSACTIONS				42				861	865		10.1042/BST20140052			AUG 2014	2014										14							WOS:000340329200022		
J	Gershoni, Moran; Pietrokovski, Shmuel								Reduced selection and accumulation of deleterious mutations in genes exclusively expressed in men								NATURE COMMUNICATIONS				5						4438	10.1038/ncomms5438			JUL 2014	2014										27							WOS:000340622900030		
J	Dunkel, Andreas; Steinhaus, Martin; Kotthoff, Matthias; Nowak, Bettina; Krautwurst, Dietmar; Schieberle, Peter; Hofmann, Thomas								Nature's Chemical Signatures in Human Olfaction: A Foodborne Perspective for Future Biotechnology								ANGEWANDTE CHEMIE-INTERNATIONAL EDITION				53	28			7124	7143		10.1002/anie.201309508			JUL 2014	2014										159							WOS:000338989500002		
J	Verbeurgt, Christophe; Wilkin, Francoise; Tarabichi, Maxime; Gregoire, Francoise; Dumont, Jacques E.; Chatelain, Pierre								Profiling of Olfactory Receptor Gene Expression in Whole Human Olfactory Mucosa								PLOS ONE				9	5					e96333	10.1371/journal.pone.0096333			MAY 6 2014	2014										49							WOS:000338029800058		
J	Ignatieva, Elena V.; Levitsky, Victor G.; Yudin, Nikolay S.; Moshkin, Mikhail P.; Kolchanov, Nikolay A.								Genetic basis of olfactory cognition: extremely high level of DNA sequence polymorphism in promoter regions of the human olfactory receptor genes revealed using the 1000 Genomes Project dataset								FRONTIERS IN PSYCHOLOGY				5						247	10.3389/fpsyg.2014.00247			MAR 24 2014	2014										19							WOS:000333243300001		
J	Hughes, Graham M.; Teeling, Emma C.; Higgins, Desmond G.								Loss of Olfactory Receptor Function in Hominin Evolution								PLOS ONE				9	1					e84714	10.1371/journal.pone.0084714			JAN 2 2014	2014										17							WOS:000329460100076		
J	Staubert, Claudia; Le Duc, Diana; Schoeneberg, Torsten								Examining the Dynamic Evolution of G Protein-Coupled Receptors								Methods in Pharmacology and Toxicology								23	43		10.1007/978-1-62703-779-2_2			2014	2014										8							WOS:000344783100003		
J		Wyatt, TD							Animals in a chemical world								PHEROMONES AND ANIMAL BEHAVIOR: CHEMICAL SIGNALS AND SIGNATURES, 2ND EDITION								1	+					2014	2014										0							WOS:000337916500001		
J	Mainland, Joel D.; Keller, Andreas; Li, Yun R.; Zhou, Ting; Trimmer, Casey; Snyder, Lindsey L.; Moberly, Andrew H.; Adipietro, Kaylin A.; Liu, Wen Ling L.; Zhuang, Hanyi; Zhan, Senmiao; Lee, Somin S.; Lin, Abigail; Matsunami, Hiroaki								The missense of smell: functional variability in the human odorant receptor repertoire								NATURE NEUROSCIENCE				17	1			114	120		10.1038/nn.3598			JAN 2014	2014										124							WOS:000329080000021		
J	Stevenson, Richard J.; Attuquayefio, Tuki								Human olfactory consciousness and cognition: its unusual features may not result from unusual functions but from limited neocortical processing resources								FRONTIERS IN PSYCHOLOGY				4						819	10.3389/fpsyg.2013.00819			NOV 1 2013	2013										15							WOS:000331577200001		
J	Jaeger, Sara R.; McRae, Jeremy F.; Bava, Christina M.; Beresford, Michelle K.; Hunter, Denise; Jia, Yilin; Chheang, Sok Leang; Jin, David; Peng, Mei; Gamble, Joanna C.; Atkinson, Kelly R.; Axten, Lauren G.; Paisley, Amy G.; Tooman, Leah; Pineau, Benedicte; Rouse, Simon A.; Newcomb, Richard D.								A Mendelian Trait for Olfactory Sensitivity Affects Odor Experience and Food Selection								CURRENT BIOLOGY				23	16			1601	1605		10.1016/j.cub.2013.07.030			AUG 19 2013	2013										68							WOS:000323401100028		
J	McRae, Jeremy F.; Jaeger, Sara R.; Bava, Christina M.; Beresford, Michelle K.; Hunter, Denise; Jia, Yilin; Chheang, Sok Leang; Jin, David; Peng, Mei; Gamble, Joanna C.; Atkinson, Kelly R.; Axten, Lauren G.; Paisley, Amy G.; Williams, Liam; Tooman, Leah; Pineau, Benedicte; Rouse, Simon A.; Newcomb, Richard D.								Identification of Regions Associated with Variation in Sensitivity to Food-Related Odors in the Human Genome								CURRENT BIOLOGY				23	16			1596	1600		10.1016/j.cub.2013.07.031			AUG 19 2013	2013										44							WOS:000323401100027		
J	Veerappa, Avinash M.; Vishweswaraiah, Sangeetha; Lingaiah, Kusuma; Murthy, Megha; Manjegowda, Dinesh S.; Nayaka, Radhika; Ramachandra, Nallur B.								Unravelling the Complexity of Human Olfactory Receptor Repertoire by Copy Number Analysis across Population Using High Resolution Arrays								PLOS ONE				8	7					e66843	10.1371/journal.pone.0066843			JUL 3 2013	2013										9							WOS:000321733000054		
J	Olender, Tsviya; Safran, Marilyn; Edgar, Ron; Stelzer, Gil; Nativ, Noam; Rosen, Naomi; Shtrichman, Ronit; Mazor, Yaron; West, Michael D.; Keydar, Ifat; Rappaport, Noa; Belinky, Frida; Warshawsky, David; Lancet, Doron								An Overview of Synergistic Data Tools for Biological Scrutiny								ISRAEL JOURNAL OF CHEMISTRY				53	3-4			185	198		10.1002/ijch.201200094			APR 2013	2013										3							WOS:000317859800009		
J	Finlay, Graeme	Finlay, G							Human Evolution Genes, Genealogies and Phylogenies Preface								HUMAN EVOLUTION: GENES, GENEALOGIES AND PHYLOGENIES								IX	+					2013	2013										0							WOS:000325967600001		
J	Keller, Andreas								Different noses for different mice and men								BMC BIOLOGY				10						75	10.1186/1741-7007-10-75			AUG 21 2012	2012										6							WOS:000307761800001		
