PT	AU	BA	CA	GP	RI	OI	BE	Z2	TI	X1	Y1	Z1	FT	PN	AE	Z3	SO	S1	SE	BS	VL	IS	SI	MA	BP	EP	AR	DI	D2	SU	PD	PY	AB	X4	Y4	Z4	AK	CT	CY	SP	CL	TC	Z8	ZB	ZS	Z9	SN	BN	UT	PM
J	Nasrin, Farhana; Rahman, Mohammad Alinoor; Masuda, Akio; Ohe, Kenji; Takeda, Jun-ichi; Ohno, Kinji								HnRNP C, YB-1 and hnRNP L coordinately enhance skipping of human MUSK exon 10 to generate a Wnt-insensitive MuSK isoform								SCIENTIFIC REPORTS				4						6841	10.1038/srep06841			OCT 30 2014	2014										15							WOS:000343986400012		
J	Cienikova, Zuzana; Damberger, Fred F.; Hall, Jonathan; Allain, Frederic H. -T.; Maris, Christophe								Structural and Mechanistic Insights into Poly(uridine) Tract Recognition by the hnRNP C RNA Recognition Motif								JOURNAL OF THE AMERICAN CHEMICAL SOCIETY				136	41			14536	14544		10.1021/ja507690d			OCT 15 2014	2014										25							WOS:000343276900037		
J	Liao, J-M; Zhou, X.; Gatignol, A.; Lu, H.								Ribosomal proteins L5 and L11 co-operatively inactivate c-Myc via RNA-induced silencing complex								ONCOGENE				33	41			4916	4923		10.1038/onc.2013.430			OCT 9 2014	2014										26							WOS:000343767900004		
J	Raj, Bushra; Irimia, Manuel; Braunschweig, Ulrich; Sterne-Weiler, Timothy; O'Hanlon, Dave; Lin, Zhen-Yuan; Chen, Ginny I.; Easton, Laura E.; Ule, Jernej; Gingras, Anne-Claude; Eyras, Eduardo; Blencowe, Benjamin J.								A Global Regulatory Mechanism for Activating an Exon Network Required for Neurogenesis								MOLECULAR CELL				56	1			90	103		10.1016/j.molcel.2014.08.011			OCT 2 2014	2014										58							WOS:000344484400011		
J	Fu, Xiang-Dong; Ares, Manuel, Jr.								Context-dependent control of alternative splicing by RNA-binding proteins								NATURE REVIEWS GENETICS				15	10			689	701		10.1038/nrg3778			OCT 2014	2014										342							WOS:000342249700013		
J	Baejen, Carlo; Torkler, Phillipp; Gressel, Saskia; Essig, Katharina; Soeding, Johannes; Cramer, Patrick								Transcriptome Maps of mRNP Biogenesis Factors Define Pre-mRNA Recognition								MOLECULAR CELL				55	5			745	757		10.1016/j.molcel.2014.08.005			SEP 4 2014	2014										54							WOS:000342618700010		
J	Sibley, Christopher R.								Regulation of gene expression through production of unstable mRNA isoforms								BIOCHEMICAL SOCIETY TRANSACTIONS				42				1196	1205		10.1042/BST20140102			AUG 2014	2014										12							WOS:000340329200078		
J	van der Lee, Robin; Buljan, Marija; Lang, Benjamin; Weatheritt, Robert J.; Daughdrill, Gary W.; Dunker, A. Keith; Fuxreiter, Monika; Gough, Julian; Gsponer, Joerg; Jones, David T.; Kim, Philip M.; Kriwacki, Richard W.; Oldfield, Christopher J.; Pappu, Rohit V.; Tompa, Peter; Uversky, Vladimir N.; Wright, Peter E.; Babu, M. Madan								Classification of Intrinsically Disordered Regions and Proteins								CHEMICAL REVIEWS				114	13			6589	6631		10.1021/cr400525m			JUL 9 2014	2014										606							WOS:000338980600003		
J	Tiedje, Christopher; Holtmann, Helmut; Gaestel, Matthias								The Role of Mammalian MAPK Signaling in Regulation of Cytokine mRNA Stability and Translation								JOURNAL OF INTERFERON AND CYTOKINE RESEARCH				34	4			220	232		10.1089/jir.2013.0146			APR 1 2014	2014										44							WOS:000333763800002		
J	Wang, Chen; Huang, Sui								Nuclear function of Alus								NUCLEUS				5	2			131	137		10.4161/nucl.28005			MAR-APR 2014	2014										15							WOS:000337956100010		
J	Mallinjoud, Pierre; Villemin, Jean-Philippe; Mortada, Hussein; Espinoza, Micaela Polay; Desmet, Francois-Olivier; Samaan, Samaan; Chautard, Emilie; Tranchevent, Leon-Charles; Auboeuf, Didier								Endothelial, epithelial, and fibroblast cells exhibit specific splicing programs independently of their tissue of origin								GENOME RESEARCH				24	3			511	521		10.1101/gr.162933.113			MAR 2014	2014										38							WOS:000332246100014		
J	Elliott, David J.								Illuminating the Transcriptome through the Genome								GENES				5	1			235	253		10.3390/genes5010235			MAR 2014	2014										4							WOS:000348855800013		
J	Bell, Christopher G.; Wilson, Gareth A.; Beck, Stephan								Human-specific CpG 'beacons' identify human-specific prefrontal cortex H3K4me3 chromatin peaks								EPIGENOMICS				6	1			21	31		10.2217/epi.13.74			FEB 2014	2014										4							WOS:000332017100008		
J	Huppertz, Ina; Attig, Jan; D'Ambrogio, Andrea; Easton, Laura E.; Sibley, Christopher R.; Sugimoto, Yoichiro; Tajnik, Mojca; Koenig, Julian; Ule, Jernej								iCLIP: Protein-RNA interactions at nucleotide resolution								METHODS				65	3			274	287		10.1016/j.ymeth.2013.10.011			FEB 2014	2014										162							WOS:000332434900003		
J	Li, Xiao; Kazan, Hilal; Lipshitz, Howard D.; Morris, Quaid D.								Finding the target sites of RNA-binding proteins								WILEY INTERDISCIPLINARY REVIEWS-RNA				5	1			111	130		10.1002/wrna.1201			JAN 2014	2014										47							WOS:000328561800008		
J	Cereda, Matteo; Pozzoli, Uberto; Rot, Gregor; Juvan, Peter; Schweitzer, Anthony; Clark, Tyson; Ule, Jernej								RNAmotifs: prediction of multivalent RNA motifs that control alternative splicing								GENOME BIOLOGY				15	1					R20	10.1186/gb-2014-15-1-r20			2014	2014										25							WOS:000332927100020		
J	Kelley, David R.; Hendrickson, David G.; Tenen, Danielle; Rinn, John L.								Transposable elements modulate human RNA abundance and splicing via specific RNA-protein interactions								GENOME BIOLOGY				15	12					537	10.1186/s13059-014-0537-5			2014	2014										46							WOS:000346609500014		
J	Mukherjee, Neelanjan; Jacobs, Nicholas C.; Hafner, Markus; Kennington, Elizabeth A.; Nusbaum, Jeffrey D.; Tuschl, Thomas; Blackshear, Perry J.; Ohler, Uwe								Global target mRNA specification and regulation by the RNA-binding protein ZFP36								GENOME BIOLOGY				15	1					R12	10.1186/gb-2014-15-1-r12			2014	2014										65							WOS:000332927100012		
J	Rinn, John L.; Ule, Jernej								'Oming in on RNA-protein interactions								GENOME BIOLOGY				15	1					401	10.1186/gb4158			2014	2014										20							WOS:000332927100030		
J	Chen, Ling-Ling; Zhao, Jing Crystal								Functional Analysis of Long Noncoding RNAs in Development and Disease								Advances in Experimental Medicine and Biology				825				129	158		10.1007/978-1-4939-1221-6_4			2014	2014										39							WOS:000350418400005		
J	Mudge, Jonathan M.; Frankish, Adam; Harrow, Jennifer								Functional transcriptomics in the post-ENCODE era								GENOME RESEARCH				23	12			1961	1973		10.1101/gr.161315.113			DEC 2013	2013										38							WOS:000327946900001		
J	Ule, Jernej								Alu elements: at the crossroads between disease and evolution								BIOCHEMICAL SOCIETY TRANSACTIONS				41				1532	1535		10.1042/BST20130157			DEC 2013	2013										18							WOS:000328282700028		
J	Lovci, Michael T.; Ghanem, Dana; Marr, Henry; Arnold, Justin; Gee, Sherry; Parra, Marilyn; Liang, Tiffany Y.; Stark, Thomas J.; Gehman, Lauren T.; Hoon, Shawn; Massirer, Katlin B.; Pratt, Gabriel A.; Black, Douglas L.; Gray, Joe W.; Conboy, John G.; Yeo, Gene W.								Rbfox proteins regulate alternative mRNA splicing through evolutionarily conserved RNA bridges								NATURE STRUCTURAL & MOLECULAR BIOLOGY				20	12			1434	1442		10.1038/nsmb.2699			DEC 2013	2013										121							WOS:000328007600016		
J	Smith, Lindsay D.; Lucas, Christian M.; Eperon, Ian C.								Intron Retention in the Alternatively Spliced Region of RON Results from Weak 3 ' Splice Site Recognition								PLOS ONE				8	10					e77208	10.1371/journal.pone.0077208			OCT 14 2013	2013										3							WOS:000325887300064		
J	Gupta, Varun K.; Scheunemann, Lisa; Eisenberg, Tobias; Mertel, Sara; Bhukel, Anuradha; Koemans, Tom S.; Kramer, Jamie M.; Liu, Karen S. Y.; Schroeder, Sabrina; Stunnenberg, Hendrik G.; Sinner, Frank; Magnes, Christoph; Pieber, Thomas R.; Dipt, Shubham; Fiala, Andre; Schenck, Annette; Schwaerzel, Martin; Madeo, Frank; Sigrist, Stephan J.								Restoring polyamines protects from age-induced memory impairment in an autophagy-dependent manner								NATURE NEUROSCIENCE				16	10			1453	+		10.1038/nn.3512			OCT 2013	2013										113							WOS:000324795300018		
J	Modic, Miha; Ule, Jernej; Sibley, Christopher R.								CLIPing the brain: Studies of protein-RNA interactions important for neurodegenerative disorders								MOLECULAR AND CELLULAR NEUROSCIENCE				56				429	435		10.1016/j.mcn.2013.04.002			SEP 2013	2013										18							WOS:000325834100041		
J	Goodier, John L.; Cheung, Ling E.; Kazazian, Haig H., Jr.								Mapping the LINE1 ORF1 protein interactome reveals associated inhibitors of human retrotransposition								NUCLEIC ACIDS RESEARCH				41	15			7401	7419		10.1093/nar/gkt512			AUG 2013	2013										68							WOS:000323970700026		
J	Anantha, Rachel W.; Alcivar, Allen L.; Ma, Jianglin; Cai, Hong; Simhadri, Srilatha; Ule, Jernej; Koenig, Julian; Xia, Bing								Requirement of Heterogeneous Nuclear Ribonucleoprotein C for BRCA Gene Expression and Homologous Recombination								PLOS ONE				8	4					e61368	10.1371/journal.pone.0061368			APR 9 2013	2013										30							WOS:000317909600108		
J	Stower, Hannah								ALTERNATIVE SPLICING Regulating Alu element 'exonization'								NATURE REVIEWS GENETICS				14	3			152	153					MAR 2013	2013										7							WOS:000315613100002		
J	Doolittle, W. Ford; Fraser, Peter; Gerstein, Mark B.; Graveley, Brenton R.; Henikoff, Steven; Huttenhower, Curtis; Oshlack, Alicia; Ponting, Chris P.; Rinn, John L.; Schatz, Michael C.; Ule, Jernej; Weigel, Detlef; Weinstock, George M.								Sixty years of genome biology								GENOME BIOLOGY				14	4					113	10.1186/gb-2013-14-4-113			2013	2013										5							WOS:000322521300013		
