PT	AU	BA	CA	GP	RI	OI	BE	Z2	TI	X1	Y1	Z1	FT	PN	AE	Z3	SO	S1	SE	BS	VL	IS	SI	MA	BP	EP	AR	DI	D2	SU	PD	PY	AB	X4	Y4	Z4	AK	CT	CY	SP	CL	TC	Z8	ZB	ZS	Z9	SN	BN	UT	PM
J	Dhalla, Fatima; Baran-Gale, Jeanette; Maio, Stefano; Chappell, Lia; Hollander, Georg A.; Ponting, Chris P.								Biologically indeterminate yet ordered promiscuous gene expression in single medullary thymic epithelial cells								EMBO JOURNAL				39	1					e101828	10.15252/embj.2019101828			JAN 2 2020	2020										0							WOS:000505543500008		
J	Ribeiro, Camila; Alves, Nuno L.; Ferreirinha, Pedro								Medullary thymic epithelial cells: Deciphering the functional diversity beyond promiscuous gene expression								IMMUNOLOGY LETTERS				215				24	27		10.1016/j.imlet.2019.01.012			NOV 2019	2019						5th European Congress of Immunology (ECI)	SEP 02-05, 2018		Amsterdam, NETHERLANDS	1							WOS:000498338300004		
J	Dhalla, Fatima; Baran-Gale, Jeanette; Maio, Stefano; Chappell, Lia; Hollaender, Georg A.; Ponting, Chris P.								Biologically indeterminate yet ordered promiscuous gene expression in single medullary thymic epithelial cells								EMBO JOURNAL										e101828	10.15252/embj.2019101828				2019										0							WOS:000492738300001		
J	Marin-Sanchez, Ana; Alvarez-Sierra, Daniel; Gonzalez, Oscar; Lucas-Martin, Ana; Selles-Sanchez, Alicia; Rudilla, Francesc; Enrich, Emma; Colobran, Roger; Pujol-Borrell, Ricardo								Regulation of TSHR Expression in the Thyroid and Thymus May Contribute to TSHR Tolerance Failure in Graves' Disease Patients via Two Distinct Mechanisms								FRONTIERS IN IMMUNOLOGY				10						1695	10.3389/fimmu.2019.01695			JUL 18 2019	2019										0							WOS:000475915400001		
J	Lancaster, J. N.; Thyagarajan, H. M.; Srinivasan, J.; Li, Y.; Hu, Z.; Ehrlich, L. I. R.								Live-cell imaging reveals the relative contributions of antigen-presenting cell subsets to thymic central tolerance								NATURE COMMUNICATIONS				10						2220	10.1038/s41467-019-09727-4			MAY 17 2019	2019										1							WOS:000468174600020		
J	Mempel, Thorsten R.; Marangoni, Francesco								Guidance factors orchestrating regulatory T cell positioning in tissues during development, homeostasis, and response								IMMUNOLOGICAL REVIEWS				289	1			129	141		10.1111/imr.12761			MAY 2019	2019										1							WOS:000465083800009		
J	Filipp, Dominik; Brabec, Tomas; Voboril, Matous; Dobes, Jan								Enteric alpha-defensins on the verge of intestinal immune tolerance and inflammation								SEMINARS IN CELL & DEVELOPMENTAL BIOLOGY				88				138	146		10.1016/j.semcdb.2018.01.007			APR 2019	2019										0							WOS:000460291000015		
J	Klein, Ludger; Robey, Ellen A.; Hsieh, Chyi-Song								Central CD4(+) T cell tolerance: deletion versus regulatory T cell differentiation								NATURE REVIEWS IMMUNOLOGY				19	1			7	18		10.1038/s41577-018-0083-6			JAN 2019	2019										10							WOS:000454709800008		
J	Morimoto, Junko; Nishikawa, Yumiko; Kakimoto, Takumi; Furutani, Kohei; Kihara, Naoki; Matsumoto, Minoru; Tsuneyama, Koichi; Kozono, Yuko; Kozono, Haruo; Hozumi, Katsuto; Hosomichi, Kazuyoshi; Nishijima, Hitoshi; Matsumoto, Mitsuru								Aire Controls in Trans the Production of Medullary Thymic Epithelial Cells Expressing Ly-6C/Ly-6G								JOURNAL OF IMMUNOLOGY				201	11			3244	3257		10.4049/jimmunol.1800950			DEC 1 2018	2018										0							WOS:000450523800013		
J	Banerjee, Soumya; Chapman, S. Jonathan								Influence of correlated antigen presentation on T-cell negative selection in the thymus								JOURNAL OF THE ROYAL SOCIETY INTERFACE				15	148					20180311	10.1098/rsif.2018.0311			NOV 2018	2018										0							WOS:000452108200002		
J	Handel, Adam E.; Shikama-Dorn, Noriko; Zhanybekova, Saule; Maio, Stefano; Graedel, Annina N.; Zuklys, Saulius; Ponting, Chris P.; Hollander, Georg A.								Comprehensively Profiling the Chromatin Architecture of Tissue Restricted Antigen Expression in Thymic Epithelial Cells Over Development								FRONTIERS IN IMMUNOLOGY				9						2120	10.3389/fimmu.2018.02120			SEP 19 2018	2018										1							WOS:000445046900001		
J	Bornstein, Chamutal; Nevo, Shir; Giladi, Amir; Kadouri, Noam; Pouzolles, Marie; Gerbe, Francois; David, Eyal; Machado, Alice; Chuprin, Anna; Toth, Beata; Goldberg, Ori; Itzkovitz, Shalev; Taylor, Naomi; Jay, Philippe; Zimmermann, Valerie S.; Abramson, Jakub; Amit, Ido								Single-cell mapping of the thymic stroma identifies IL-25-producing tuft epithelial cells								NATURE				559	7715			622	+		10.1038/s41586-018-0346-1			JUL 26 2018	2018										21							WOS:000439850800058		
J	Pohar, Jelka; Simon, Quentin; Fillatreau, Simon								Antigen-Specificity in the Thymic Development and Peripheral Activity of CD4(+)FOXP3(+) T Regulatory Cells								FRONTIERS IN IMMUNOLOGY				9						1701	10.3389/fimmu.2018.01701			JUL 23 2018	2018										2							WOS:000439457800001		
J	Thyagarajan, Hiran M.; Lancaster, Jessica N.; Lira, Sergio A.; Ehrlich, Lauren I. R.								CCR8 is expressed by post-positive selection CD4-lineage thymocytes but is dispensable for central tolerance induction								PLOS ONE				13	7					e0200765	10.1371/journal.pone.0200765			JUL 19 2018	2018										1							WOS:000439120000049		
J	Cheng, Mickie; Anderson, Mark S.								Thymic tolerance as a key brake on autoimmunity								NATURE IMMUNOLOGY				19	7			659	664		10.1038/s41590-018-0128-9			JUL 2018	2018										6							WOS:000436341300011		
J	Kernfeld, Eric M.; Genga, Ryan M. J.; Neherin, Kashfia; Magaletta, Margaret E.; Xu, Ping; Maehr, Rene								A Single-Cell Transcriptomic Atlas of Thymus Organogenesis Resolves Cell Types and Developmental Maturation								IMMUNITY				48	6			1258	+		10.1016/j.immuni.2018.04.015			JUN 19 2018	2018										16							WOS:000436456900023		
J	O'Sullivan, Brendan J.; Yekollu, Suman; Ruscher, Roland; Mehdi, Ahmed M.; Maradana, Muralidhara Rao; Chidgey, Ann P.; Thomas, Ranjeny								Autoimmune-Mediated Thymic Atrophy Is Accelerated but Reversible in ReIB-Deficient Mice								FRONTIERS IN IMMUNOLOGY				9						109	10.3389/fimmu.2018.01092			MAY 22 2018	2018										1							WOS:000432685900002		
J	Sykes, Megan								IXA Honorary Member Lecture, 2017: The long and winding road to tolerance								XENOTRANSPLANTATION				25	3					e12419	10.1111/xen.12419			MAY-JUN 2018	2018										3							WOS:000435447300012		
J	Apert, Cecile; Romagnoli, Paola; van Meerwijk, Joost P. M.								IL-2 and IL-15 dependent thymic development of Foxp3-expressing regulatory T lymphocytes								PROTEIN & CELL				9	4			322	332		10.1007/s13238-017-0425-3			APR 2018	2018										10							WOS:000428849800002		
J	Perniola, Roberto								Twenty Years of AIRE								FRONTIERS IN IMMUNOLOGY				9						98	10.3389/fimmu.2018.00098			FEB 12 2018	2018										12							WOS:000424778100002		
J	Koh, Andrew S.; Miller, Erik L.; Buenrostro, Jason D.; Moskowitz, David M.; Wang, Jing; Greenleaf, William J.; Chang, Howard Y.; Crabtree, Gerald R.								Rapid chromatin repression by Aire provides precise control of immune tolerance								NATURE IMMUNOLOGY				19	2			162	+		10.1038/s41590-017-0032-8			FEB 2018	2018										5							WOS:000423435200016		
J	Miragaia, Ricardo J.; Zhang, Xiuwei; Gomes, Tomas; Svensson, Valentine; Ilicic, Tomislav; Henriksson, Johan; Kar, Gozde; Lonnberg, Tapio								Single-cell RNA-sequencing resolves self-antigen expression during mTEC development								SCIENTIFIC REPORTS				8						685	10.1038/s41598-017-19100-4			JAN 12 2018	2018										4							WOS:000419945800003		
J	Giladi, Amir; Amit, Ido								Single-Cell Genomics: A Stepping Stone for Future Immunology Discoveries								CELL				172	1-2			14	21		10.1016/j.cell.2017.11.011			JAN 11 2018	2018										33							WOS:000419840100006		
J	Papalexi, Efthymia; Satija, Rahul								Single-cell RNA sequencing to explore immune cell heterogeneity								NATURE REVIEWS IMMUNOLOGY				18	1			35	45		10.1038/nri.2017.76			JAN 2018	2018										121							WOS:000422802500009		
J	Passos, Geraldo A.; Speck-Hernandez, Cesar A.; Assis, Amanda F.; Mendes-da-Cruz, Daniella A.								Update on Aire and thymic negative selection								IMMUNOLOGY				153	1			10	20		10.1111/imm.12831			JAN 2018	2018										14							WOS:000417762800002		
J	Mouri, Yasuhiro; Ueda, Yoshihiro; Yamano, Tomoyoshi; Matsumoto, Minoru; Tsuneyama, Koichi; Kinashi, Tatsuo; Matsumoto, Mitsuru								Mode of Tolerance Induction and Requirement for Aire Are Governed by the Cell Types That Express Self-Antigen and Those That Present Antigen								JOURNAL OF IMMUNOLOGY				199	12			3959	3971		10.4049/jimmunol.1700892			DEC 15 2017	2017										4							WOS:000417018100005		
J	Michel, Chloe; Miller, Corey N.; Kuechler, Rita; Brors, Benedikt; Anderson, Mark S.; Kyewski, Bruno; Pinto, Sheena								Revisiting the Road Map of Medullary Thymic Epithelial Cell Differentiation								JOURNAL OF IMMUNOLOGY				199	10			3488	3503		10.4049/jimmunol.1700203			NOV 15 2017	2017										6							WOS:000414660600010		
J	Ki, Sanghee; Thyagarajan, Hiran M.; Hu, Zicheng; Lancaster, Jessica N.; Ehrlich, Lauren I. R.								EBI2 contributes to the induction of thymic central tolerance in mice by promoting rapid motility of medullary thymocytes								EUROPEAN JOURNAL OF IMMUNOLOGY				47	11			1906	1917		10.1002/eji.201747020			NOV 2017	2017										6							WOS:000414677400008		
J	Takaba, Hiroyuki; Takayanagi, Hiroshi								The Mechanisms of T Cell Selection in the Thymus								TRENDS IN IMMUNOLOGY				38	11			805	816		10.1016/j.it.2017.07.010			NOV 2017	2017										28							WOS:000413828300003		
J	Roberts, Natalie A.; Adams, Brian D.; McCarthy, Nicholas I.; Tooze, Reuben M.; Parnell, Sonia M.; Anderson, Graham; Kaech, Susan M.; Horsley, Valerie								Prdm1 Regulates Thymic Epithelial Function To Prevent Autoimmunity								JOURNAL OF IMMUNOLOGY				199	4			1250	1260		10.4049/jimmunol.1600941			AUG 15 2017	2017										6							WOS:000407061400004		
J	Rodrigues, Pedro M.; Ribeiro, Ana R.; Perrod, Chiara; Landry, Jonathan J. M.; Araujo, Leonor; Pereira-Castro, Isabel; Benes, Vladimir; Moreira, Alexandra; Xavier-Ferreira, Helena; Meireles, Catarina; Alves, Nuno L.								Thymic epithelial cells require p53 to support their long-term function in thymopoiesis in mice								BLOOD				130	4			478	488		10.1182/blood-2016-12-758961			JUL 27 2017	2017										5							WOS:000406492000018		
J	Dal Molin, Alessandra; Baruzzo, Giacomo; Di Camillo, Barbara								Single-Cell RNA-Sequencing: Assessment of Differential Expression Analysis Methods								FRONTIERS IN GENETICS				8						62	10.3389/fgene.2017.00062			MAY 23 2017	2017										15							WOS:000402737000001		
J	Li, Huipeng; Courtois, Elise T.; Sengupta, Debarka; Tan, Yuliana; Chen, Kok Hao; Goh, Jolene Jie Lin; Kong, Say Li; Chua, Clarinda; Hon, Lim Kiat; Tan, Wah Siew; Wong, Mark; Choi, Paul Jongjoon; Wee, Lawrence J. K.; Hillmer, Axel M.; Tan, Iain Beehuat; Robson, Paul; Prabhakar, Shyam								Reference component analysis of single-cell transcriptomes elucidates cellular heterogeneity in human colorectal tumors								NATURE GENETICS				49	5			708	+		10.1038/ng.3818			MAY 2017	2017										140							WOS:000400051400011		
J	Takahama, Yousuke; Ohigashi, Izumi; Baik, Song; Anderson, Graham								Generation of diversity in thymic epithelial cells								NATURE REVIEWS IMMUNOLOGY				17	5			295	305		10.1038/nri.2017.12			MAY 2017	2017										42							WOS:000400050400008		
J	Svensson, Valentine; Natarajan, Kedar Nath; Ly, Lam-Ha; Miragaia, Ricardo J.; Labalette, Charlotte; Macaulay, Iain C.; Cvejic, Ana; Teichmann, Sarah A.								Power analysis of single-cell RNA-sequencing experiments								NATURE METHODS				14	4			381	+		10.1038/nmeth.4220			APR 2017	2017										143							WOS:000397900500016		
J	Bansal, Kushagra; Yoshida, Hideyuki; Benoist, Christophe; Mathis, Diane								The transcriptional regulator Aire binds to and activates super-enhancers								NATURE IMMUNOLOGY				18	3			263	273		10.1038/ni.3675			MAR 2017	2017										26							WOS:000394413400006		
J	Abramson, Jakub; Anderson, Graham								Thymic Epithelial Cells								Annual Review of Immunology				35				85	118		10.1146/annurev-immunol-051116-052320			2017	2017										58							WOS:000401334800004		
J	Ke, Rongqin; Mignardi, Marco; Hauling, Thomas; Nilsson, Mats								Fourth Generation of Next-Generation Sequencing Technologies: Promise and Consequences								HUMAN MUTATION				37	12			1363	1367		10.1002/humu.23051			DEC 2016	2016										10							WOS:000388701600013		
J	Pearson, Hillary; Daouda, Tariq; Granados, Diana Paola; Durette, Chantal; Bonneil, Eric; Courcelles, Mathieu; Rodenbrock, Anja; Laverdure, Jean-Philippe; Cote, Caroline; Mader, Sylvie; Lemieux, Sebastien; Thibault, Pierre; Perreault, Claude								MHC class I-associated peptides derive from selective regions of the human genome								JOURNAL OF CLINICAL INVESTIGATION				126	12			4690	4701		10.1172/JCI88590			DEC 1 2016	2016										49							WOS:000390131900027		
J	Liu, Juan; Cao, Xuetao								Cellular and molecular regulation of innate inflammatory responses								CELLULAR & MOLECULAR IMMUNOLOGY				13	6			711	721		10.1038/cmi.2016.58			NOV 2016	2016										46							WOS:000387974300001		
J	Perry, Justin S. A.; Hsieh, Chyi-Song								Development of T-cell tolerance utilizes both cell-autonomous and cooperative presentation of self-antigen								IMMUNOLOGICAL REVIEWS				271	1			141	155		10.1111/imr.12403			MAY 2016	2016										25							WOS:000374498000010		
J	Abramson, Jakub; Husebye, Eystein S.								Autoimmune regulator and self-tolerance - molecular and clinical aspects								IMMUNOLOGICAL REVIEWS				271	1			127	140		10.1111/imr.12419			MAY 2016	2016										38							WOS:000374498000009		
J	Alves, Nuno L.; Ribeiro, Ana R.								Thymus medulla under construction: Time and space oddities								EUROPEAN JOURNAL OF IMMUNOLOGY				46	4			829	833		10.1002/eji.201646329			APR 2016	2016										7							WOS:000374552700005		
J	Mathis, Diane; Benoist, Christophe								Promiscuity Promotes Tolerance								JOURNAL OF IMMUNOLOGY				196	7			2913	2914		10.4049/jimmunol.1600225			APR 1 2016	2016										1							WOS:000372339100001		
J	Anderson, Mark S.; Su, Maureen A.								AIRE expands: new roles in immune tolerance and beyond								NATURE REVIEWS IMMUNOLOGY				16	4			247	258		10.1038/nri.2016.9			APR 2016	2016										58							WOS:000372977200010		
J	Proserpio, Valentina; Loennberg, Tapio								Single-cell technologies are revolutionizing the approach to rare cells								IMMUNOLOGY AND CELL BIOLOGY				94	3			225	229		10.1038/icb.2015.106			MAR 2016	2016										30							WOS:000372616700003		
J	Rattay, Kristin; Meyer, Hannah Verena; Herrmann, Carl; Brors, Benedikt; Kyewski, Bruno								Evolutionary conserved gene co-expression drives generation of self-antigen diversity in medullary thymic epithelial cells								JOURNAL OF AUTOIMMUNITY				67				65	75		10.1016/j.jaut.2015.10.001			FEB 2016	2016										7							WOS:000370884900008		
J	Ehrlich, Lauren I. R.								Control of Migration during Intrathymic T Cell Development								ENCYCLOPEDIA OF IMMUNOBIOLOGY, VOL 1: DEVELOPMENT AND PHYLOGENY OF THE IMMUNE SYSTEM								249	262		10.1016/B978-0-12-374279-7.04012-1			2016	2016										1							WOS:000490117200031		
J	Matsumoto, Mitsuru								Switching on the Aire conditioner								EUROPEAN JOURNAL OF IMMUNOLOGY				45	12			3237	3240		10.1002/eji.201546098			DEC 2015	2015										0							WOS:000366402000005		
J	Hu, Zicheng; Lancaster, Jessica N.; Sasiponganan, Chayanit; Ehrlich, Lauren I. R.								CCR4 promotes medullary entry and thymocyte-dendritic cell interactions required for central tolerance								JOURNAL OF EXPERIMENTAL MEDICINE				212	11			1947	1965		10.1084/jem.20150178			OCT 19 2015	2015										32							WOS:000366926800020		
J	Anderson, Graham; Jenkinson, William E.								Co-ordination of intrathymic self-representation								NATURE IMMUNOLOGY				16	9			895	896		10.1038/ni.3251			SEP 2015	2015										0							WOS:000359876900003		
J	Chan, Alice Y.; Anderson, Mark S.								Central tolerance to self revealed by the autoimmune regulator								Annals of the New York Academy of Sciences				1356				80	89		10.1111/nyas.12960			2015	2015										14							WOS:000364539900004		
