PT	AU	BA	CA	GP	RI	OI	BE	Z2	TI	X1	Y1	Z1	FT	PN	AE	Z3	SO	S1	SE	BS	VL	IS	SI	MA	BP	EP	AR	DI	D2	SU	PD	PY	AB	X4	Y4	Z4	AK	CT	CY	SP	CL	TC	Z8	ZB	ZS	Z9	SN	BN	UT	PM
J	Hekselman, Idan; Yeger-Lotem, Esti								Mechanisms of tissue and cell-type specificity in heritable traits and diseases								NATURE REVIEWS GENETICS											10.1038/s41576-019-0200-9				2020										0							WOS:000508152300001		
J	Band, Gavin; Le, Quang Si; Clarke, Geraldine M.; Kivinen, Katja; Hubbart, Christina; Jeffreys, Anna E.; Rowlands, Kate; Leffler, Ellen M.; Jallow, Muminatou; Conway, David J.; Sisay-Joof, Fatoumatta; Sirugo, Giorgio; d'Alessandro, Umberto; Toure, Ousmane B.; Thera, Mahamadou A.; Konate, Salimata; Sissoko, Sibiri; Mangano, Valentina D.; Bougouma, Edith C.; Sirima, Sodiomon B.; Amenga-Etego, Lucas N.; Ghansah, Anita K.; Hodgson, Abraham V. O.; Wilson, Michael D.; Enimil, Anthony; Ansong, Daniel; Evans, Jennifer; Ademola, Subulade A.; Apinjoh, Tobias O.; Ndila, Carolyne M.; Manjurano, Alphaxard; Drakeley, Chris; Reyburn, Hugh; Nguyen Hoan Phu; Nguyen Thi Ngoc Quyen; Cao Quang Thai; Tran Tinh Hien; Teo, Yik Ying; Manning, Laurens; Laman, Moses; Michon, Pascal; Karunajeewa, Harin; Siba, Peter; Allen, Steve; Allen, Angela; Bahlo, Melanie; Davis, Timothy M. E.; Simpson, Victoria; Shelton, Jennifer; Spencer, Chris C. A.; Busby, George B. J.; Kerasidou, Angeliki; Drury, Eleanor; Stalker, Jim; Dilthey, Alexander; Mentzer, Alexander J.; McVean, Gil; Bojang, Kalifa A.; Doumbo, Ogobara; Modiano, David; Koram, Kwadwo A.; Agbenyega, Tsiri; Amodu, Olukemi K.; Achidi, Eric; Williams, Thomas N.; Marsh, Kevin; Riley, Eleanor M.; Molyneux, Malcolm; Taylor, Terrie; Dunstan, Sarah J.; Farrar, Jeremy; Mueller, Ivo; Rockett, Kirk A.; Kwiatkowski, Dominic P.		Malaria Genomic Epidemiology Net						Insights into malaria susceptibility using genome-wide data on 17,000 individuals from Africa, Asia and Oceania								NATURE COMMUNICATIONS				10						5732	10.1038/s41467-019-13480-z			DEC 16 2019	2019										0							WOS:000502769900001		
J	Fiszbein, Ana; Krick, Keegan S.; Begg, Bridget E.; Burge, Christopher B.								Exon-Mediated Activation of Transcription Starts								CELL				179	7			1551	+		10.1016/j.cell.2019.11.002			DEC 12 2019	2019										1							WOS:000502546200013		
J	Wei, Wu; Hennig, Bianca P.; Wang, Jingwen; Zhang, Yujie; Piazza, Ilaria; Sanchez, Yerma Pareja; Chabbert, Christophe D.; Adjalley, Sophie H.; Steinmetz, Lars M.; Pelechano, Vicent								Chromatin-sensitive cryptic promoters putatively drive expression of alternative protein isoforms in yeast								GENOME RESEARCH				29	12			1974	1984		10.1101/gr.243378.118			DEC 2019	2019										0							WOS:000500554200005		
J	Furlanis, Elisabetta; Traunmueller, Lisa; Fucile, Geoffrey; Scheiffele, Peter								Landscape of ribosome-engaged transcript isoforms reveals extensive neuronal-cell-class-specific alternative splicing programs								NATURE NEUROSCIENCE				22	10			1709	+		10.1038/s41593-019-0465-5			OCT 2019	2019										3							WOS:000493396200021		
J	Gruber, Andreas J.; Zavolan, Mihaela								Alternative cleavage and polyadenylation in health and disease								NATURE REVIEWS GENETICS				20	10			599	614		10.1038/s41576-019-0145-z			OCT 2019	2019										1							WOS:000487297600007		
J	Demircioglu, Deniz; Cukuroglu, Engin; Kindermans, Martin; Nandi, Tannistha; Calabrese, Claudia; Fonseca, Nuno A.; Kahles, Andre; Kjong-Van Lehmann; Stegle, Oliver; Brazma, Alvis; Brooks, Angela N.; Ratsch, Gunnar; Tan, Patrick; Goke, Jonathan								A Pan-cancer Transcriptome Analysis Reveals Pervasive Regulation through Alternative Promoters								CELL				178	6			1465	+		10.1016/j.cell.2019.08.018			SEP 5 2019	2019										1							WOS:000483983000019		
J	McCartney, Ann M.; Hyland, Edel M.; Cormican, Paul; Moran, Raymond J.; Webb, Andrew E.; Lee, Kate D.; Hernandez-Rodriguez, Jessica; Prado-Martinez, Javier; Creevey, Christopher J.; Aspden, Julie L.; McInerney, James O.; Marques-Bonet, Tomas; O'Connell, Mary J.								Gene Fusions Derived by Transcriptional Readthrough are Driven by Segmental Duplication in Human								GENOME BIOLOGY AND EVOLUTION				11	9			2678	2690		10.1093/gbe/evz163			SEP 2019	2019										1							WOS:000491234700019		
J	Gomes Ferreira, Monique Drielle; Castro, Jacqueline Araujo; Santana Silva, Raner Jose; Micheli, Fabienne								HVA22 from citrus: A small gene family whose some members are involved in plant response to abiotic stress								PLANT PHYSIOLOGY AND BIOCHEMISTRY				142				395	404		10.1016/j.plaphy.2019.08.003			SEP 2019	2019										0							WOS:000487569200041		
J	Li, Jingyi Jessica; Chew, Guo-Liang; Biggin, Mark Douglas								Quantitative principles of cis-translational control by general mRNA sequence features in eukaryotes								GENOME BIOLOGY				20	1					162	10.1186/s13059-019-1761-9			AUG 9 2019	2019										1							WOS:000480563300004		
J	Bhardwaj, Vivek; Semplicio, Giuseppe; Erdogdu, Niyazi Umut; Manke, Thomas; Akhtar, Asifa								MAPCap allows high-resolution detection and differential expression analysis of transcription start sites								NATURE COMMUNICATIONS				10						3219	10.1038/s41467-019-11115-x			JUL 30 2019	2019										0							WOS:000477860000001		
J	MacDonald, Clinton C.								Tissue-specific mechanisms of alternative polyadenylation: Testis, brain, and beyond (2018 update)								WILEY INTERDISCIPLINARY REVIEWS-RNA				10	4					e1526	10.1002/wrna.1526			JUL 2019	2019										2							WOS:000471696300006		
J	Korthauer, Keegan; Kimes, Patrick K.; Duvallet, Claire; Reyes, Alejandro; Subramanian, Ayshwarya; Teng, Mingxiang; Shukla, Chinmay; Alm, Eric J.; Hicks, Stephanie C.								A practical guide to methods controlling false discoveries in computational biology								GENOME BIOLOGY				20						118	10.1186/s13059-019-1716-1			JUN 4 2019	2019										4							WOS:000470326700001		
J	Klein, Jason C.; Keith, Aidan; Rice, Sarah J.; Shepherd, Colin; Agarwal, Vikram; Loughlin, John; Shendure, Jay								Functional testing of thousands of osteoarthritis-associated variants for regulatory activity								NATURE COMMUNICATIONS				10						2434	10.1038/s41467-019-10439-y			JUN 4 2019	2019										2							WOS:000470082000001		
J	Zhao, Shanrong								Alternative splicing, RNA-seq and drug discovery								DRUG DISCOVERY TODAY				24	6			1258	1267		10.1016/j.drudis.2019.03.030			JUN 2019	2019										5							WOS:000474328800006		
J	Haney, Robert A.; Matte, Taylor; Forsyth, FitzAnthony S.; Garb, Jessica E.								Alternative Transcription at Venom Genes and Its Role as a Complementary Mechanism for the Generation of Venom Complexity in the Common House Spider								FRONTIERS IN ECOLOGY AND EVOLUTION				7						85	10.3389/fevo.2019.00085			APR 24 2019	2019										1							WOS:000467427400001		
J	Shiau, Cheng-Kai; Huang, Jia-Hsin; Tsai, Huai-Kuang								CATANA: a tool for generating comprehensive annotations of alternative transcript events								BIOINFORMATICS				35	8			1414	1415		10.1093/bioinformatics/bty795			APR 15 2019	2019										0							WOS:000473691900020		
J	Kannan, Kavya; Shook, Molly; Li, Yang; Robinson, Gene E.; Ma, Jian								Comparative Analysis of Brain and Fat Body Gene Splicing Patterns in the Honey Bee, Apis mellifera								G3-GENES GENOMES GENETICS				9	4			1055	1063		10.1534/g3.118.200857			APR 2019	2019										0							WOS:000463929500009		
J	Naro, Chiara; Pellegrini, Livia; Jolly, Ariane; Farini, Donatella; Cesari, Eleonora; Bielli, Pamela; de la Grange, Pierre; Sette, Claudio								Functional Interaction between U1snRNP and Sam68 Insures Proper 3 ' End Pre-mRNA Processing during Germ Cell Differentiation								CELL REPORTS				26	11			2929	+		10.1016/j.celrep.2019.02.058			MAR 12 2019	2019										3							WOS:000460914700008		
J	Campla, Christie K.; Mast, Hannah; Dong, Lijin; Lei, Jingqi; Halford, Stephanie; Sekaran, Sumathi; Swaroop, Anand								Targeted deletion of an NRL- and CRX-regulated alternative promoter specifically silences FERM and PDZ domain containing 1 (Frmpd1) in rod photoreceptors								HUMAN MOLECULAR GENETICS				28	5			804	817		10.1093/hmg/ddy388			MAR 1 2019	2019										0							WOS:000463241600008		
J	Bhattarai, Sunil; Aly, Ahmed; Garcia, Kristy; Ruiz, Diandra; Pontarelli, Fabrizio; Dharap, Ashutosh								Deep Sequencing Reveals Uncharted Isoform Heterogeneity of the Protein-Coding Transcriptome in Cerebral Ischemia								MOLECULAR NEUROBIOLOGY				56	2			1035	1043		10.1007/s12035-018-1147-0			FEB 2019	2019										2							WOS:000460470300019		
J	Soneson, Charlotte; Love, Michael I.; Patro, Rob; Hussain, Shobbir; Malhotra, Dheeraj; Robinson, Mark D.								A junction coverage compatibility score to quantify the reliability of transcript abundance estimates and annotation catalogs								LIFE SCIENCE ALLIANCE				2	1					e201800175	10.26508/lsa.201800175			FEB 2019	2019										5							WOS:000457337300009		
J	Alasoo, Kaur; Rodrigues, Julia; Danesh, John; Freitag, Daniel F.; Paul, Dirk S.; Gaffney, Daniel J.								Genetic effects on promoter usage are highly context-specific and contribute to complex traits								ELIFE				8						e41673	10.7554/eLife.41673			JAN 8 2019	2019										2							WOS:000456973300001		
J	Zhao, Jing; Qin, Bo; Nikolay, Rainer; Spahn, Christian M. T.; Zhang, Gong								Translatomics: The Global View of Translation								INTERNATIONAL JOURNAL OF MOLECULAR SCIENCES				20	1					212	10.3390/ijms20010212			JAN 1 2019	2019										2							WOS:000459747700212		
J	Grozdanov, Petar N.; Masoumzadeh, Elahe; Latham, Michael P.; MacDonald, Clinton C.								The structural basis of CstF-77 modulation of cleavage and polyadenylation through stimulation of CstF-64 activity								NUCLEIC ACIDS RESEARCH				46	22			12022	12039		10.1093/nar/gky862			DEC 14 2018	2018										1							WOS:000456714000033		
J	Caceres, Alejandro; Gonzalez, Juan R.								When pitch adds to volume: coregulation of transcript diversity predicts gene function								BMC GENOMICS				19						926	10.1186/s12864-018-5263-z			DEC 13 2018	2018										0							WOS:000453236900001		
J	Andreassi, Catia; Crerar, Hamish; Riccio, Antonella								Post-transcriptional Processing of mRNA in Neurons: The Vestiges of the RNA World Drive Transcriptome Diversity								FRONTIERS IN MOLECULAR NEUROSCIENCE				11						304	10.3389/fnmol.2018.00304			AUG 28 2018	2018										2							WOS:000442958600001		
J	Zhu, Fu-Yuan; Chen, Mo-Xian; Ye, Neng-Hui; Qiao, Wang-Min; Gao, Bei; Law, Wai-Ki; Tian, Yuan; Zhang, Dong; Zhang, Di; Liu, Tie-Yuan; Hu, Qi-Juan; Cao, Yun-Ying; Su, Ze-Zhuo; Zhang, Jianhua; Liu, Ying-Gao								Comparative performance of the BGISEQ-500 and Illumina HiSeq4000 sequencing platforms for transcriptome analysis in plants								PLANT METHODS				14							10.1186/s13007-018-0337-0			AUG 13 2018	2018										11							WOS:000441376000001		
J	Figueiredo Cardoso, Taina; Quintanilla, Raquel; Castello, Anna; Gonzalez-Prendes, Rayner; Amills, Marcel; Canovas, Angela								Differential expression of mRNA isoforms in the skeletal muscle of pigs with distinct growth and fatness profiles								BMC GENOMICS				19						145	10.1186/s12864-018-4515-2			FEB 14 2018	2018										6							WOS:000425518400002		
